"title","age","genres","imdb","rotten_tomatoes","keywords","year","netflix","hulu","prime","disney"
"Breaking Bad","TV-MA","Crime, Drama, Thriller",9.5,96,"High School, Teacher, Doctor, Drug, Gangster",2008,1,0,0,0
"Stranger Things","TV-14","Drama, Fantasy, Horror, Mystery, Science-Fiction, Thriller, Action & Adventure",8.8,93,"Friendship, Monster, Space, Suspense, Supernatural, Science",2016,1,0,0,0
"Money Heist","TV-MA","Thriller, Action & Adventure, Crime, Mystery, Drama",8.4,91,"",2017,1,0,0,0
"Sherlock","TV-14","Action & Adventure, Crime, Drama, Mystery, Thriller",9.1,78,"",2010,1,0,0,0
"Avatar: The Last Airbender","TV-PG","Action & Adventure, Animation, Family, Fantasy, Mystery",9.2,100,"Friendship, Martial Arts, Magic, Religion",2005,1,0,0,0
"The Office","TV-14","",8.9,81,"",2005,1,0,0,0
"Better Call Saul","TV-MA","Comedy, Crime, Drama",8.7,97,"",2015,1,0,0,0
"Supernatural","TV-14","Drama, Fantasy, Horror, Mystery, Science-Fiction, Thriller",8.4,93,"Free Services, Netflix, TNT, fuboTV, Monster, Time Travel, Vampire, Supernatural, Ghost",2005,1,0,0,0
"Dark","TV-14","Crime, Drama, Mystery, Science-Fiction, Thriller, Fantasy",8.7,94,"",2017,1,0,0,0
"Black Mirror","TV-MA","Drama, Science-Fiction, Fantasy, Thriller, Mystery",8.8,83,"Dystopia, Space, Technology, Futuristic",2011,1,0,0,0
"Peaky Blinders","TV-MA","",8.8,92,"War, Racing, Drug, Gangster, World War II",2013,1,0,0,0
"Attack on Titan","TV-14","Action & Adventure, Anime, Animation, Drama, Fantasy, Horror, Mystery, Science-Fiction",8.8,94,"Free Services, Netflix, Hulu, Crunchyroll, Adult Swim, fuboTV, Funimation, Dystopia, Monster, Disaster, Supernatural, Adaptation, Political",2013,1,1,0,0
"The Walking Dead","TV-MA","Drama, Horror, Thriller, Action & Adventure, Fantasy, Science-Fiction",8.2,81,"Netflix, AMC, fuboTV, AMC Premiere, Dystopia, Apocalypse, Comic Book, Zombie, Survival, Adaptation",2010,1,0,0,0
"Narcos","TV-MA","Crime, Drama, Biography, Thriller, Action & Adventure",8.8,89,"",2015,1,0,0,0
"Community","TV-PG","",8.5,88,"Friendship, College, Zombie, Parody",2009,1,1,0,0
"Ozark","TV-MA","Crime, Drama, Thriller, Mystery",8.4,81,"",2017,1,0,0,0
"Mindhunter","TV-MA","Crime, Drama, Thriller",8.6,96,"Police, Suspense, Serial Killer, Psychology, Based On True Story",2017,1,0,0,0
"Parks and Recreation","TV-14","",8.6,93,"Netflix, Prime Video, Hulu, NBC, Comedy Central, fuboTV",2009,1,1,1,0
"Fullmetal Alchemist: Brotherhood","TV-MA","Action & Adventure, Anime, Animation, Drama, Fantasy, Comedy, Science-Fiction, Mystery",9.1,100,"Free Services, Netflix, HBO MAX, Hulu, Funimation, Supernatural, Science, Adaptation, Political",2009,1,1,0,0
"Dexter","TV-MA","Crime, Drama, Mystery, Thriller",8.6,72,"",2006,1,0,0,0
"Marvel's Daredevil","TV-MA","Action & Adventure, Crime, Drama, Fantasy, Science-Fiction, Thriller, Mystery",8.6,92,"Supernatural, Superhero, Comic Book, Disney, Adaptation",2015,1,0,0,0
"One-Punch Man","TV-14","Animation, Anime, Action & Adventure, Comedy, Fantasy, Science-Fiction",8.8,100,"Free Services, Netflix, Hulu, Adult Swim, fuboTV, Alien, Monster, Martial Arts, Supernatural, Superhero, Parody, Fighting, Adaptation, Sports, Political",2015,1,1,0,0
"Twin Peaks","TV-MA","Drama, Horror, Mystery, Crime, Thriller, Fantasy, Romance",8.8,89,"Netflix, Showtime, Hulu, CBS All Access, Police, Supernatural, Ghost, Serial Killer, Teen",1990,1,1,0,0
"The Witcher","TV-MA","Drama, Action & Adventure, Fantasy, Horror, Mystery",8.3,67,"Based on Books, Monster, Magic, Supernatural, Science, Adaptation",2019,1,0,0,0
"Outlander","TV-MA","Drama, Fantasy, Science-Fiction, Romance, History, Animation, Comedy, Action & Adventure",8.4,91,"Based on Books, Time Travel, Magic, Adaptation, Political",2014,1,0,0,0
"The Last Kingdom","TV-MA","Action & Adventure, History, Romance, Drama",8.4,91,"",2015,1,0,0,0
"The Good Place","TV-14","Comedy, Drama, Fantasy, Romance, Science-Fiction",8.2,97,"Free Services, Netflix, Hulu, NBC, fuboTV",2016,1,1,0,0
"House of Cards","TV-MA","Drama, Sport, Crime",8.7,77,"",2013,1,0,0,0
"Mad Men","TV-14","",8.6,94,"",2007,1,0,0,0
"The Flash","TV-PG","Drama, Action & Adventure, Fantasy, Science-Fiction, Crime",7.7,89,"Time Travel, Supernatural, Superhero, Comic Book, Adaptation",2014,1,0,0,0
"The 100","TV-14","Drama, Science-Fiction, Action & Adventure, Mystery, Fantasy, Thriller",7.7,93,"Based on Books, Dystopia, Apocalypse, Space, Disaster, Survival, Adaptation, Teen",2014,1,0,0,0
"Shameless","TV-MA","",8.6,85,"",2011,1,0,0,0
"The Haunting","TV-MA","Horror, Drama, Mystery, Thriller",8.7,93,"Based on Books, Suspense, Supernatural, Ghost, Adaptation",2018,1,0,0,0
"The Blacklist","TV-14","Action & Adventure, Thriller, Crime, Drama, Mystery",8,91,"",2013,1,0,0,0
"Dead to Me","TV-MA","Comedy, Drama, Mystery, Crime",8.1,91,"",2019,1,0,0,0
"Lucifer","TV-14","Fantasy, Crime, Science-Fiction, Drama, Comedy",8.2,87,"Police, Supernatural, Superhero, Comic Book, Religion, Adaptation",2016,1,0,0,0
"Never Have I Ever","TV-14","",8,96,"",2020,1,0,0,0
"Grey's Anatomy","TV-14","",7.6,83,"",2005,1,1,0,0
"Orange Is the New Black","TV-MA","Comedy, LGBTQ, Crime, Drama",8.1,90,"",2013,1,0,0,0
"Marvel's Agents of S.H.I.E.L.D.","TV-14","Action & Adventure, Drama, Fantasy, Science-Fiction, Thriller",7.5,95,"Free Services, Netflix, Hulu, ABC, Supernatural, Superhero, Comic Book, Disney, Adaptation",2013,1,0,0,0
"After Life","TV-MA","",8.5,70,"",2019,1,0,0,0
"Arrested Development","TV-14","",8.7,75,"",2003,1,1,0,0
"The End of the F***ing World","TV-MA","Action & Adventure, Comedy, Crime, Drama, Romance, Thriller",8.1,93,"Dark Comedy, War, Psychology, Feel-good, Teen",2017,1,0,0,0
"When They See Us","TV-MA","Thriller, Biography, Drama, History",8.9,96,"",2019,1,0,0,0
"How to Get Away with Murder","TV-14","Drama, Thriller, Crime, Mystery",8.1,88,"",2014,1,1,0,0
"The Crown","TV-MA","",8.7,89,"America, United Kingdom",2016,1,0,0,0
"The Vampire Diaries","TV-14","Drama, Fantasy, Horror, Romance, Mystery, Thriller, Science-Fiction",7.7,86,"Based on Books, Vampire, Supernatural, Adaptation, Teen",2009,1,0,0,0
"BoJack Horseman","TV-MA","Animation, Comedy, Drama",8.7,93,"Space, Drug, Psychology, Genius, Animal, Mature",2014,1,0,0,0
"Penny Dreadful","TV-MA","Horror, Thriller, Drama, Fantasy",8.2,91,"Monster, Vampire, Doctor, Supernatural, Religion",2014,1,0,0,0
"American Crime Story","TV-MA","Biography, Drama, Crime",8.4,93,"Police, Serial Killer, Adaptation, Based On True Story",2016,1,0,0,0
"Sense8","TV-MA","Drama, LGBTQ, Mystery, Science-Fiction, Thriller, Fantasy",8.3,86,"",2015,1,0,0,0
"Elite","TV-MA","Crime, Drama, Thriller, Mystery",7.6,97,"",2018,1,0,0,0
"Sacred Games","TV-MA","Drama, Action & Adventure, Crime, Thriller",8.7,92,"",2018,1,0,0,0
"Arrow","TV-14","Drama, Action & Adventure, Fantasy, Crime, Mystery, Science-Fiction",7.6,85,"Supernatural, Superhero, Comic Book, Serial Killer, Adaptation",2012,1,0,0,0
"Sex Education","TV-14","",8.3,94,"",2019,1,0,0,0
"Unbelievable","TV-MA","",8.4,97,"",2019,1,0,0,0
"The IT Crowd","TV-14","",8.5,87,"",2006,1,0,0,0
"The Twilight Zone","TV-PG","Fantasy, Science-Fiction, Drama, Horror, Mystery, Thriller",9,82,"Escape, Space, Time Travel, Suspense",1959,1,1,0,0
"YOU","TV-MA","Crime, Drama, Romance, Thriller",7.8,91,"",2018,1,0,0,0
"Unorthodox","TV-MA","",8.1,94,"",2020,1,0,0,0
"Broadchurch","TV-MA","Crime, Drama, Mystery, Thriller",8.4,92,"",2013,1,0,0,0
"Star Trek: The Next Generation","TV-PG","Action & Adventure, Drama, Science-Fiction, Mystery, Fantasy",8.6,89,"Netflix, Prime Video, Hulu, CBS All Access",1987,1,1,1,0
"Altered Carbon","TV-MA","Mystery, Science-Fiction, Action & Adventure, Drama, Thriller, Fantasy",8.1,64,"Dystopia, War, Space, Technology, Suspense, Science, Fighting, Futuristic",2018,1,0,0,0
"The Sinner","TV-14","Drama, Crime, Thriller, Mystery",8,95,"Based on Books, Drug, Religion, Adaptation",2017,1,0,0,0
"Kingdom","TV-MA","Action & Adventure, Drama, Horror, Thriller, Mystery, Science-Fiction, Fantasy, History",8.4,96,"Suspense, Doctor, Zombie, Medieval",2019,1,0,0,0
"Love, Death & Robots","TV-MA","Animation, Science-Fiction, Comedy, Fantasy, Horror",8.5,78,"",2019,1,0,0,0
"Marvel's Jessica Jones","TV-MA","Action & Adventure, Crime, Drama, Science-Fiction, Thriller, Fantasy",8,83,"Supernatural, Superhero, Comic Book, Psychology, Disney, Adaptation",2015,1,0,0,0
"The Good Wife","TV-14","Crime, Drama, Mystery",8.3,94,"Netflix, Prime Video, Hulu, CBS All Access",2009,1,1,1,0
"The Umbrella Academy","TV-14","Action & Adventure, LGBTQ, Comedy, Drama, Fantasy, Science-Fiction, Mystery",7.9,77,"",2019,1,0,0,0
"Bodyguard","TV-MA","Thriller, Crime, Drama, Action & Adventure",8.1,93,"Military, Police, Suspense, Political",2018,1,0,0,0
"New Girl","TV-14","",7.7,94,"",2011,1,0,0,0
"Marvel's The Punisher","TV-MA","Action & Adventure, Crime, Drama, Science-Fiction, Thriller",8.5,63,"Supernatural, Superhero, Comic Book, Disney, Adaptation",2017,1,0,0,0
"Schitt's Creek","TV-14","",8.4,50,"Free Services, Netflix, Prime Video, fuboTV",2015,1,0,1,0
"Master of None","TV-MA","",8.3,100,"",2015,1,0,0,0
"Tiger King: Murder, Mayhem and Madness","TV-MA","Documentary, LGBTQ, Crime",7.8,86,"",2020,1,0,0,0
"The West Wing","TV-14","",8.8,75,"",1999,1,0,0,0
"Death Note","TV-MA","Animation, Anime, Crime, Fantasy, Drama, Mystery, Thriller",9,NA,"Police, Time Travel, Suspense, Supernatural, Serial Killer, Adaptation",2006,1,1,0,0
"Gomorrah","TV-MA","Drama, Crime, Thriller",8.7,94,"",2014,1,0,0,0
"Once Upon a Time","TV-PG","Drama, Fantasy, Action & Adventure, Romance, Science-Fiction",7.7,80,"Magic, Supernatural, Psychology, Disney, Adaptation",2011,1,0,0,0
"Bates Motel","TV-MA","Crime, Drama, Horror, Mystery, Thriller",8.2,93,"",2013,1,0,0,0
"Riverdale","TV-14","Drama, Crime, Mystery, Romance, Thriller",7,86,"High School, Comic Book, Adaptation, Teen",2017,1,0,0,0
"Ash vs Evil Dead","TV-MA","Comedy, Horror, Action & Adventure, Fantasy, Thriller",8.4,99,"",2015,1,0,0,0
"Making a Murderer","TV-14","",8.6,84,"Prison, Revenge, Teen, Political",2015,1,0,0,0
"Narcos: Mexico","TV-MA","Action & Adventure, Crime, Drama",8.4,88,"",2018,1,0,0,0
"Atypical","TV-MA","Comedy, Drama, Romance",8.3,87,"Coming of Age, High School, Doctor, Teen",2017,1,0,0,0
"Burn Notice","TV-PG","Action & Adventure, Crime, Drama, Thriller, Mystery",7.9,88,"Netflix, Prime Video, Hulu, USA",2007,1,1,1,0
"Russian Doll","TV-MA","Comedy, Drama, Mystery, Fantasy",7.9,96,"",2019,1,0,0,0
"Resurrection: Ertugrul","TV-14","Action & Adventure, Drama, History",7.8,NA,"",2014,1,0,0,0
"Big Mouth","TV-MA","Animation, Comedy, Romance",8,100,"",2017,1,0,0,0
"American Horror Story","TV-MA","Drama, Horror, Thriller, Fantasy, Mystery, Science-Fiction",8,NA,"Time Travel, Vampire, Doctor, Supernatural, Ghost, Serial Killer, Religion",2011,1,1,1,0
"Our Planet","TV-PG","",9.3,93,"",2019,1,0,0,0
"Gotham","TV-14","Drama, Action & Adventure, Crime, Thriller, Fantasy, Science-Fiction",7.8,77,"Doctor, Supernatural, Superhero, Comic Book, Serial Killer, Adaptation",2014,1,0,0,0
"Castlevania","TV-MA","Animation, Action & Adventure, Fantasy, Horror",8.2,93,"Vampire, Doctor, Magic, Supernatural, Medieval, Religion, Video Games, Adaptation",2017,1,0,0,0
"Criminal Minds","TV-14","Crime, Drama, Mystery, Thriller, Horror",8.1,NA,"",2005,1,0,0,0
"Fauda","TV-14","Thriller, Action & Adventure, Drama, Crime",8.2,100,"Military, War, Suspense, Spy",2015,1,0,0,0
"Star Trek","TV-PG","Action & Adventure, Drama, Science-Fiction, Fantasy",8.3,80,"Netflix, Prime Video, Hulu, CBS All Access",1966,1,1,1,0
"I Am Not Okay with This","TV-MA","Action & Adventure, Comedy, Drama, Fantasy, Science-Fiction",7.6,85,"",2020,1,0,0,0
"Anne with an E","TV-PG","",8.7,62,"",2017,1,0,0,0
"DC's Legends of Tomorrow","TV-14","Action & Adventure, Science-Fiction, Drama, Fantasy",6.8,87,"Time Travel, Supernatural, Superhero, Comic Book, Adaptation",2016,1,0,0,0
"The OA","TV-14","Drama, Fantasy, Mystery, Science-Fiction",7.9,84,"",2016,1,0,0,0
"Outer Banks","TV-MA","Action & Adventure, Crime, Drama, Mystery, Romance, Thriller",7.6,72,"",2020,1,0,0,0
"Chilling Adventures of Sabrina","TV-14","Action & Adventure, Drama, Fantasy, Horror, Mystery, Thriller, Science-Fiction",7.6,84,"High School, Magic, Supernatural, Comic Book, Adaptation, Teen",2018,1,0,0,0
"The Vietnam War","TV-MA","",9.1,98,"",2017,1,0,0,0
"Gilmore Girls","TV-14","",8.1,85,"High School, Dating, College, Teen",2000,1,0,0,0
"Into the Night","TV-MA","Drama, Science-Fiction, Thriller, Fantasy",7.1,83,"",2020,1,0,0,0
"iZombie","TV-14","Drama, Science-Fiction, Action & Adventure, Crime, Horror, Comedy, Fantasy",7.9,91,"Apocalypse, Doctor, Supernatural, Superhero, Comic Book, Zombie, Adaptation",2015,1,0,0,0
"Good Girls","TV-14","Drama, Comedy, Crime",7.9,87,"Free Services, Netflix, Hulu, NBC, fuboTV",2018,1,1,0,0
"Neon Genesis Evangelion","TV-14","Action & Adventure, Anime, Drama, Science-Fiction, Animation, Thriller, Fantasy",8.5,100,"Robot, Technology, Science, Psychology",1995,1,0,0,0
"Weeds","TV-MA","Comedy, Crime, Drama",7.9,70,"",2005,1,0,0,0
"A Series of Unfortunate Events","TV-PG","Action & Adventure, Drama, Family, Mystery, Comedy",7.8,96,"",2017,1,0,0,0
"Into the Badlands","TV-14","",8,83,"Dystopia, Apocalypse, Martial Arts, Futuristic",2015,1,0,0,0
"Waco","TV-MA","Crime, Cult, Drama, Thriller, History",7.9,68,"",2018,1,0,0,0
"NCIS","TV-14","Action & Adventure, Mystery, Crime, Drama, Comedy",7.8,40,"Free Services, Netflix, CBS All Access, USA, fuboTV",2003,1,0,0,0
"Hollywood","TV-MA","",7.6,57,"",2020,1,0,0,0
"Grace and Frankie","TV-PG","Comedy, LGBTQ, Drama",8.3,89,"",2015,1,0,0,0
"Halt and Catch Fire","TV-14","",8.4,90,"",2014,1,0,0,0
"Naruto","TV-PG","Action & Adventure, Anime, Animation, Comedy, Fantasy, Thriller, Drama, Mystery",8.3,NA,"Friendship, Martial Arts, Supernatural, Fighting, Adaptation",2002,1,1,0,0
"Scandal","TV-14","Drama, Crime, Romance, Thriller",7.7,93,"",2012,1,0,0,0
"The Midnight Gospel","TV-MA","Animation, Action & Adventure, Comedy, Fantasy, Science-Fiction",8.3,90,"Space, Psychology, Genius, Mature",2020,1,0,0,0
"Lost in Space","TV-PG","Science-Fiction, Action & Adventure, Drama, Family, Mystery, Fantasy",7.3,75,"Dystopia, Robot, Space, Science, Survival",2018,1,0,0,0
"Person of Interest","TV-14","Action & Adventure, Drama, Mystery, Thriller, Crime, Science-Fiction, Fantasy",8.4,NA,"Dystopia, Police, War, Technology, Spy, Political",2011,1,0,0,0
"Monty Python's Flying Circus","TV-14","",8.8,100,"",1969,1,0,0,0
"Unbreakable Kimmy Schmidt","TV-14","",7.6,96,"",2015,1,0,0,0
"Jane the Virgin","TV-PG","Drama, Family, Romance, Comedy",7.8,100,"",2014,1,0,0,0
"Hunter x Hunter","TV-14","Action & Adventure, Anime, Animation, Comedy, Fantasy, Drama",8.9,NA,"Free Services, Netflix, Hulu, Adult Swim, Coming of Age, Friendship, Revenge, Martial Arts, Technology, Supernatural, Fighting, Adaptation",2011,1,1,0,0
"Godless","TV-14","Drama, Documentary, Crime",8.3,85,"",2017,1,0,0,0
"Mushi-Shi","TV-14","Animation, Anime, Drama, Fantasy, Horror, Mystery, Thriller, Action & Adventure, History",8.5,100,"Free Services, Netflix, Prime Video, Hulu, Funimation, Supernatural, Ghost, Psychology, Religion, Adaptation",2005,1,1,1,0
"GLOW","TV-MA","Comedy, Drama, Sport",8,92,"Wrestling, Sports, Feel-good, Based On True Story",2017,1,0,0,0
"Alias Grace","TV-MA","Biography, Crime, Drama",7.8,99,"Based on Books, Suspense, Adaptation, Based On True Story",2017,1,0,0,0
"13 Reasons Why","TV-MA","Drama, Mystery, Thriller",7.7,39,"High School, Based on Books, Music, Adaptation, Teen",2017,1,0,0,0
"Manhunt","TV-14","Crime, Drama, Mystery, Thriller",8.1,93,"",2017,1,0,0,0
"Gossip Girl","TV-14","Drama, Romance, Comedy",7.4,84,"Based on Books, New York, Dating, Adaptation, Teen",2008,1,0,0,0
"Star Trek: Deep Space Nine","TV-PG","Action & Adventure, Drama, Science-Fiction, Fantasy",7.9,90,"Netflix, Prime Video, Hulu, CBS All Access, BBC America, fuboTV, Alien, Space, Time Travel, Science, Political",1993,1,1,1,0
"The Dragon Prince","TV-PG","Action & Adventure, Animation, Fantasy, Family, Science-Fiction",8.4,100,"Magic, Supernatural, Animal, Royalty",2018,1,0,0,0
"Dirty Money","TV-14","",8.1,100,"",2018,1,0,0,0
"Locke & Key","TV-14","Drama, Fantasy, Horror, Thriller, Mystery, Science-Fiction",7.4,66,"",2020,1,0,0,0
"Maniac","TV-14","Comedy, Drama, Science-Fiction, Fantasy",7.8,85,"",2018,1,0,0,0
"Locked Up","TV-14","Drama, Thriller, Mystery, Comedy, Crime",8.3,100,"",2015,1,0,0,0
"Colony","TV-14","Drama, Action & Adventure, Fantasy, Science-Fiction, Thriller",7.4,92,"Dystopia, War, Apocalypse, Space, Political",2016,1,0,0,0
"Rectify","TV-14","",8.3,95,"",2013,1,0,0,0
"Charmed","TV-14","Drama, Science-Fiction, Fantasy, Mystery, Thriller, Comedy",7.1,75,"War, Time Travel, Vampire, Magic, Supernatural",1998,1,0,0,0
"American Vandal","TV-14","Comedy, Mystery, Crime, Drama",8.2,97,"",2017,1,0,0,0
"Marvel's Luke Cage","TV-MA","Drama, Action & Adventure, Crime, Science-Fiction, Thriller, Mystery, Fantasy",7.3,87,"Supernatural, Superhero, Comic Book, Disney, Adaptation",2016,1,0,0,0
"Santa Clarita Diet","TV-MA","",7.8,89,"",2017,1,0,0,0
"The Dark Crystal: Age of Resistance","TV-PG","Drama, Action & Adventure, Family, Fantasy, Horror, Mystery, Science-Fiction",8.5,87,"America, United Kingdom",2019,1,0,0,0
"Wild Wild Country","TV-14","Documentary, Cult, Crime",8.2,98,"",2018,1,0,0,0
"Derry Girls","TV-14","",8.4,97,"",2018,1,0,0,0
"Pose","TV-14","",8.6,96,"",2018,1,0,0,0
"One Day at a Time","TV-PG","",8.2,99,"",2017,1,0,0,0
"Dark Matter","TV-MA","Drama, Science-Fiction, Thriller, Action & Adventure, Mystery",7.5,89,"Robot, Space, Time Travel, Technology, Comic Book, Adaptation",2015,1,0,0,0
"Law & Order: Special Victims Unit","TV-14","Drama, Action & Adventure, Thriller, Crime, Mystery",8,NA,"Free Services, Netflix, Prime Video, Hulu, NBC, USA, fuboTV",1999,1,1,1,0
"Reign","TV-14","Drama, Fantasy, History",7.5,86,"Medieval, Royalty, Adaptation, Teen, Based On True Story, Political",2013,1,0,0,0
"The Tudors","TV-MA","Action & Adventure, Drama, Romance, History",8.1,69,"Princess, Medieval, Religion, Royalty, Political",2007,1,0,0,0
"The Stranger","TV-14","Crime, Drama, Mystery, Thriller",7.3,89,"",2020,1,0,0,0
"Supergirl","TV-PG","Drama, Fantasy, Action & Adventure, Science-Fiction",6.3,88,"Supernatural, Superhero, Comic Book, Adaptation",2015,1,0,0,0
"Call the Midwife","TV-PG","Drama, History, Family",8.4,89,"",2012,1,0,0,0
"On My Block","TV-14","",8.1,97,"",2018,1,0,0,0
"Longmire","TV-14","Drama, Action & Adventure, Crime",8.3,88,"",2012,1,0,0,0
"Extras","TV-14","",8.3,89,"",2005,1,0,1,0
"The 4400","TV-PG","Drama, Science-Fiction, Mystery, Thriller, Fantasy",7.3,95,"Dystopia, Space, Time Travel, Supernatural",2004,1,0,0,0
"HAPPY!","TV-MA","Fantasy, Action & Adventure, Comedy, Crime, Mystery, Thriller, Science-Fiction, Drama",8.2,84,"Friendship, Comic Book, Imagination, Adaptation",2017,1,0,0,0
"Doctor Foster","TV-14","",7.7,85,"",2015,1,0,0,0
"Designated Survivor","TV-PG","Drama, Action & Adventure, Mystery",7.5,71,"Dystopia, Apocalypse, Spy, Disney, Political",2016,1,0,0,0
"The Inbetweeners","TV-MA","",8.4,54,"High School, Friendship, Mature, Teen",2008,1,0,0,0
"Love","TV-MA","Comedy, Romance, Drama",7.7,94,"",2016,1,0,0,0
"The Spy","TV-MA","Drama, Thriller, History",7.9,86,"Based on Books, Spy, Adaptation, Political",2019,1,0,0,0
"The Kominsky Method","TV-MA","",8.2,90,"",2018,1,0,0,0
"Mystery Science Theater 3000","TV-PG","Comedy, Science-Fiction, Fantasy",8.5,80,"Free Services, Netflix, Hulu, IFC, fuboTV",1988,1,1,0,0
"Marco Polo","TV-MA","Action & Adventure, Drama, History, Thriller",8,67,"",2014,1,0,0,0
"Marvel's The Defenders","TV-MA","Action & Adventure, Crime, Fantasy, Science-Fiction",7.3,78,"Supernatural, Superhero, Comic Book, Disney, Adaptation",2017,1,0,0,0
"Ripper Street","TV-MA","Drama, Crime, Mystery, Thriller",8.1,100,"",2012,1,0,0,0
"The Fosters","TV-14","Drama, Family, Romance",7.9,97,"",2013,1,0,0,0
"Queer Eye","TV-14","Comedy, LGBTQ, Reality",8.5,91,"",2018,1,0,0,0
"Bleach","TV-MA","Action & Adventure, Anime, Animation, Fantasy, Comedy, Drama, Horror, Science-Fiction, Thriller",8.1,NA,"",2004,1,1,0,0
"The Borgias","TV-MA","Crime, Drama, History, Action & Adventure",7.9,85,"Hungary, Canada, America",2011,1,0,0,0
"Hawaii Five-0","TV-14","Action & Adventure, Crime, Drama",7.3,82,"",2010,1,0,0,0
"The Shannara Chronicles","TV-14","Action & Adventure, Fantasy, Science-Fiction, Drama",7.2,77,"Based on Books, Time Travel, Magic, Supernatural, Futuristic, Adaptation, Teen",2016,1,0,0,0
"Middleditch & Schwartz","TV-MA","",8.7,100,"",2020,1,0,0,0
"Star Trek: Voyager","TV-PG","Action & Adventure, Drama, Science-Fiction, Fantasy",7.8,77,"Netflix, Prime Video, Hulu, CBS All Access",1995,1,1,1,0
"Hell on Wheels","TV-14","",8.3,72,"",2011,1,0,0,0
"Limitless","TV-14","Drama, Science-Fiction, Thriller, Comedy, Crime, Action & Adventure",7.7,57,"",2015,1,0,0,0
"Jonathan Strange & Mr Norrell","TV-14","Drama, Fantasy, History, Science-Fiction",8.1,91,"",2015,1,0,0,0
"Top Boy","TV-MA","Drama, Crime, Thriller, Mystery",8.4,95,"",2011,1,0,0,0
"Queen of the South","TV-14","Drama, Action & Adventure, Crime",7.9,66,"",2016,1,0,0,0
"Delhi Crime",NA,"",8.5,91,"",2019,1,0,0,0
"Haven","TV-14","Crime, Drama, Fantasy, Science-Fiction, Horror, Mystery, Thriller",7.5,63,"Based on Books, Police, Time Travel, Supernatural, Ghost, Adaptation, Canada, America",2010,1,0,0,0
"Messiah","TV-MA","Drama, Thriller, Mystery",7.7,44,"",2020,1,0,0,0
"Feel Good",NA,"Comedy, LGBTQ, Drama, Romance",7.5,100,"",2020,1,0,0,0
"Haikyu!!","TV-14","Animation, Anime, Sport, Comedy, Drama",8.7,NA,"",2014,1,1,0,0
"Wynonna Earp","TV-14","Drama, LGBTQ, Action & Adventure, Crime, Fantasy, Science-Fiction",7.4,93,"America, Canada",2016,1,0,0,0
"Crash Landing on You","TV-14","Drama, Comedy, Romance, Action & Adventure",8.8,NA,"",2019,1,0,0,0
"Hart of Dixie","TV-PG","Comedy, Drama, Romance",7.7,81,"",2011,1,0,0,0
"Bloodline","TV-MA","Drama, Thriller, Crime",8,62,"",2015,1,0,0,0
"The Magicians","TV-14","Drama, Action & Adventure, Fantasy, Horror",7.6,NA,"Based on Books, New York, Time Travel, College, Magic, Supernatural, Adaptation",2015,1,0,0,0
"Don't F**k with Cats: Hunting an Internet Killer","TV-MA","Crime, Documentary, Mystery",8.1,67,"",2019,1,0,0,0
"Lost Girl","TV-14","Crime, Drama, Fantasy, Horror, Science-Fiction",7.7,65,"",2010,1,0,0,0
"That '70s Show","TV-14","Comedy, Romance, Family",8.1,NA,"Netflix, IFC, Comedy Central, fuboTV",1998,1,0,0,0
"Travelers","TV-14","Drama, Mystery, Science-Fiction, Thriller, Fantasy, Action & Adventure",8.1,NA,"",2016,1,0,0,0
"TURN: Washington's Spies","TV-14","Action & Adventure, Drama, History",8.1,81,"",2014,1,0,0,0
"Chef's Table","TV-G","",8.6,100,"",2015,1,0,0,0
"Soul Eater","TV-14","Action & Adventure, Anime, Animation, Comedy, Fantasy, Horror, Science-Fiction",7.8,100,"",2008,1,1,0,0
"Merlin","TV-PG","Action & Adventure, Fantasy, Drama, Science-Fiction, Animation, Family",7.9,NA,"Free Services, Netflix, Prime Video, Hulu, Magic, Supernatural, Medieval, Animal",2008,1,1,1,0
"Crazy Ex-Girlfriend","TV-14","",7.8,98,"",2015,1,0,0,0
"Living with Yourself","TV-MA","",7.2,84,"",2019,1,0,0,0
"Galavant","TV-PG","Comedy, Fantasy, Action & Adventure, Musical",8.1,89,"Music, Parody, Singing, Royalty, Disney",2015,1,0,0,0
"The Originals","TV-14","Drama, Fantasy, Science-Fiction, Mystery, Thriller, Horror",8.2,27,"",2013,1,0,0,0
"Ezel","TV-G","Crime, Drama, Thriller, Action & Adventure",8.6,NA,"",2009,1,0,0,0
"The Keepers","TV-14","Documentary, Crime, Drama, Mystery, Thriller",8.1,96,"",2017,1,0,0,0
"Malcolm in the Middle","TV-PG","",8,NA,"",2000,1,1,0,0
"Episodes","TV-MA","",7.8,80,"",2011,1,0,0,0
"Marvel's Iron Fist","TV-MA","Action & Adventure, Crime, Fantasy, Science-Fiction, Drama",6.5,37,"Martial Arts, Supernatural, Superhero, Comic Book, Disney, Adaptation",2017,1,0,0,0
"Case Closed","TV-14","Action & Adventure, Anime, Animation, Crime, Mystery, Comedy, Drama, Romance, Thriller",8.4,NA,"Free Services, Netflix, Hulu, Crunchyroll",1996,1,1,0,0
"Absolutely Fabulous","TV-14","",8.1,96,"",1992,1,1,0,0
"F is for Family","TV-MA","Animation, Comedy, Drama",8,86,"",2015,1,0,0,0
"Hilda","TV-PG","Action & Adventure, Animation, Children, Family, Comedy, Fantasy",8.6,100,"Magic, Supernatural, Psychology, Animal",2018,1,0,0,0
"Babylon Berlin","TV-MA","Crime, Drama, History, Thriller",8.4,NA,"",2017,1,0,0,0
"Dead Set","TV-MA","Horror, Drama, Comedy",7.7,90,"Dark Comedy, Dystopia, Apocalypse, Zombie, Survival, Political",2008,1,0,0,0
"Disenchantment","TV-14","Animation, Comedy, Fantasy, Action & Adventure, Science-Fiction",7.2,68,"",2018,1,0,0,0
"Nurse Jackie","TV-MA","",7.7,81,"",2009,1,0,0,0
"Fairy Tail","TV-14","Animation, Anime, Fantasy, Action & Adventure, Comedy, Science-Fiction",8,NA,"Free Services, Netflix, Hulu, Funimation, Time Travel, Magic, Adaptation, Mature",2009,1,1,0,0
"Chewing Gum","TV-14","",7.7,100,"",2015,1,0,0,0
"Imposters","TV-14","Drama, Comedy, Mystery",7.8,100,"",2017,1,0,0,0
"Pokémon","TV-PG","Animation, Anime, Action & Adventure, Comedy, Family, Fantasy, Science-Fiction, Children",7.5,NA,"Free Services, Netflix, Prime Video, Hulu",1997,1,1,1,0
"Cheer","TV-14","Documentary, Reality, Sport",8.2,96,"",2020,1,0,0,0
"The Staircase","TV-14","Documentary, Crime, Drama",7.9,93,"",2005,1,0,0,0
"She-Ra and the Princesses of Power","TV-G","Animation, Children, Family, Action & Adventure, Comedy, Drama, Fantasy, Science-Fiction",7.5,97,"",2018,1,0,0,0
"The Order","TV-MA","Drama, Mystery, Fantasy, Horror, Science-Fiction, Action & Adventure",6.9,100,"",2019,1,0,0,0
"Blue Mountain State","TV-MA","",8.3,NA,"",2010,1,0,0,0
"Madam Secretary","TV-14","",7.6,68,"",2014,1,0,0,0
"Queer as Folk","TV-MA","",8.2,100,"Free Services, Netflix, Prime Video, Showtime, AcornTV",1999,1,0,1,0
"Cheers","TV-PG","",7.8,NA,"Free Services, Netflix, Prime Video, Hulu, CBS All Access",1982,1,1,1,0
"Legacies","TV-14","Drama, Mystery, Action & Adventure, Fantasy, Horror, Science-Fiction",7.5,NA,"",2018,1,0,0,0
